{
  "$schema": "https://json-schema.org/draft/2020-12/schema",
  "$id": "strada-delle-ere/cards.schema.json",
  "title": "La Strada delle Ere — database carte",
  "description": "Fonte unica dei dati di gioco. Godot carica questo file; un validatore lo controlla prima di ogni build.",
  "type": "object",
  "required": ["meta", "constants", "terrains", "buildings", "characters", "upgrades", "events", "monuments", "legacies"],
  "$defs": {
    "cls": { "enum": ["militare", "religione", "commercio", "cultura", "civico", "ingegneria"] },
    "terrain": { "enum": ["pianura", "fiume", "collina", "bosco"] },
    "era": { "type": "integer", "minimum": 1, "maximum": 5 },
    "res": {
      "type": "object",
      "properties": {
        "pietra": { "type": "integer", "minimum": 0 },
        "oro": { "type": "integer", "minimum": 0 }
      },
      "additionalProperties": false
    },
    "id": { "type": "string", "pattern": "^[a-z]{2}_[a-z0-9_]+$" }
  },
  "properties": {
    "meta": {
      "type": "object",
      "required": ["game", "ruleset"],
      "properties": { "ruleset": { "type": "string" } }
    },
    "constants": { "type": "object" },
    "terrains": {
      "type": "array", "minItems": 4, "maxItems": 4,
      "items": {
        "type": "object",
        "required": ["id", "base_production", "identity"],
        "properties": {
          "id": { "$ref": "#/$defs/terrain" },
          "base_production": { "$ref": "#/$defs/res" }
        }
      }
    },
    "buildings": {
      "type": "array", "minItems": 60, "maxItems": 60,
      "items": {
        "type": "object",
        "required": ["id", "name", "era", "classes", "width", "cost", "resistance", "rendita", "lampo", "scavo", "level_required", "production", "flexible"],
        "properties": {
          "id": { "$ref": "#/$defs/id" },
          "era": { "$ref": "#/$defs/era" },
          "classes": { "type": "array", "minItems": 1, "maxItems": 2, "items": { "$ref": "#/$defs/cls" } },
          "terrain": { "oneOf": [{ "type": "null" }, { "type": "string" }] },
          "width": { "enum": [1, 2, 3] },
          "cost": { "$ref": "#/$defs/res" },
          "flexible": { "type": "boolean" },
          "resistance": { "type": "integer", "minimum": 0, "maximum": 6 },
          "rendita": { "type": "integer", "minimum": 0 },
          "lampo": { "type": "integer", "minimum": 0 },
          "scavo": { "enum": [0, 2, 3, 5, 6, 8] },
          "level_required": { "type": "integer", "minimum": 0, "maximum": 4 },
          "production": {
            "type": "object",
            "properties": {
              "pietra": { "type": "integer" }, "oro": { "type": "integer" }, "cultura": { "type": "integer" }
            }
          },
          "exhaustible": { "type": "integer", "minimum": 0 },
          "effect_text": { "type": "string" }
        }
      }
    },
    "characters": {
      "type": "array",
      "items": {
        "type": "object",
        "required": ["id", "name", "class", "timing", "effect_text"],
        "properties": {
          "era": { "oneOf": [{ "type": "null" }, { "$ref": "#/$defs/era" }] },
          "class": { "$ref": "#/$defs/cls" },
          "timing": { "enum": ["subito", "era", "misto", "finale", "permanente"] },
          "is_dynasty": { "type": "boolean" },
          "imprint": { "type": "boolean" }
        }
      }
    },
    "upgrades": {
      "type": "array", "minItems": 25, "maxItems": 25,
      "items": {
        "type": "object",
        "required": ["id", "name", "era", "class", "cost", "family"],
        "properties": { "family": { "enum": ["arte", "struttura", "altro"] } }
      }
    },
    "events": {
      "type": "array", "minItems": 24, "maxItems": 24,
      "items": {
        "type": "object",
        "required": ["id", "name", "era", "force", "severity", "effect_text"],
        "properties": {
          "era": { "type": "integer", "minimum": 1, "maximum": 4 },
          "force": { "type": "integer", "minimum": 2, "maximum": 5 },
          "severity": { "enum": ["lieve", "grave"] }
        }
      }
    },
    "monuments": { "type": "array", "minItems": 14, "maxItems": 14 },
    "legacies": { "type": "array", "minItems": 16, "maxItems": 16 }
  }
}
