{
  "meta": {
    "game": "La Strada delle Ere",
    "ruleset": "1.5",
    "language": "it",
    "source": "distinta-carte (fonte unica)"
  },
  "constants": {
    "eras": 5,
    "rails": 5,
    "columns_by_players": {
      "2": 5,
      "3": 7,
      "4": 9
    },
    "terrain_mix_by_players": {
      "2": {
        "pianura": 2,
        "fiume": 2,
        "collina": 1,
        "bosco": 0
      },
      "3": {
        "pianura": 2,
        "fiume": 2,
        "collina": 2,
        "bosco": 1
      },
      "4": {
        "pianura": 3,
        "fiume": 3,
        "collina": 2,
        "bosco": 1
      }
    },
    "workers_base": 3,
    "start_resources": {
      "pietra": 2,
      "oro": 0
    },
    "second_player_bonus_2p": {
      "oro": 1
    },
    "event_force_by_era": {
      "1": 2,
      "2": 3,
      "3": 4,
      "4": 5
    },
    "resource_cap": 5,
    "protection_bonus": 2,
    "vetusta_max": 3,
    "vetusta_max_bosco": 4,
    "rudere_penalty": 2,
    "verticality_vp": {
      "1": 2,
      "2": 6,
      "3": 12,
      "4": 20
    },
    "continuity_vp": {
      "2": 2,
      "3": 5
    },
    "upgrade_cost_by_era": {
      "1": 1,
      "2": 1,
      "3": 1,
      "4": 2,
      "5": 2
    },
    "recruit_cost_oro": 1,
    "terrapieno_cost_pietra": 1,
    "rubble_discount_pietra": 1,
    "prosperity": {
      "min_buildings": 3,
      "min_owners": 2,
      "gold_per_owner": 1
    },
    "level_cap_per_era_per_column": 1,
    "market_size": 6,
    "side_rows": 3
  },
  "terrains": [
    {
      "id": "pianura",
      "base_production": {
        "pietra": 2,
        "oro": 0
      },
      "identity": "sviluppo",
      "rule": "Edifici da 2 o 3 caselle costano 1 pietra in meno."
    },
    {
      "id": "fiume",
      "base_production": {
        "pietra": 1,
        "oro": 1
      },
      "identity": "liquidita",
      "rule": "Unico terreno che produce oro. Requisito 'fiume' stretto."
    },
    {
      "id": "collina",
      "base_production": {
        "pietra": 2,
        "oro": 0
      },
      "identity": "monumentalita",
      "rule": "Ogni edificio costruito qui ha +1 resistenza permanente."
    },
    {
      "id": "bosco",
      "base_production": {
        "pietra": 2,
        "oro": 0
      },
      "identity": "conservazione",
      "rule": "Vetusta massima +4 e restauro -1 pietra."
    }
  ],
  "buildings": [
    {
      "id": "ed_capanne",
      "name": "Capanne",
      "era": 1,
      "classes": [
        "civico"
      ],
      "terrain": "pianura",
      "width": 1,
      "cost": {
        "pietra": 1,
        "oro": 0
      },
      "flexible": false,
      "resistance": 1,
      "rendita": 0,
      "lampo": 1,
      "scavo": 2,
      "level_required": 0,
      "production": {
        "pietra": 1,
        "oro": 0,
        "cultura": 0
      },
      "exhaustible": 0
    },
    {
      "id": "ed_dolmen",
      "name": "Dolmen",
      "era": 1,
      "classes": [
        "religione"
      ],
      "terrain": "collina",
      "width": 1,
      "cost": {
        "pietra": 2,
        "oro": 0
      },
      "flexible": false,
      "resistance": 3,
      "rendita": 1,
      "lampo": 0,
      "scavo": 3,
      "level_required": 0,
      "production": {
        "pietra": 0,
        "oro": 0,
        "cultura": 0
      },
      "exhaustible": 0,
      "effect_text": ""
    },
    {
      "id": "ed_grotte_dipinte",
      "name": "Grotte dipinte",
      "era": 1,
      "classes": [
        "cultura"
      ],
      "terrain": "collina",
      "width": 1,
      "cost": {
        "pietra": 1,
        "oro": 0
      },
      "flexible": false,
      "resistance": 2,
      "rendita": 0,
      "lampo": 0,
      "scavo": 6,
      "level_required": 0,
      "production": {
        "pietra": 0,
        "oro": 0,
        "cultura": 0
      },
      "exhaustible": 0
    },
    {
      "id": "ed_approdo",
      "name": "Approdo",
      "era": 1,
      "classes": [
        "commercio"
      ],
      "terrain": "fiume",
      "width": 1,
      "cost": {
        "pietra": 1,
        "oro": 0
      },
      "flexible": true,
      "resistance": 1,
      "rendita": 0,
      "lampo": 0,
      "scavo": 2,
      "level_required": 0,
      "production": {
        "pietra": 1,
        "oro": 0,
        "cultura": 0
      },
      "exhaustible": 0
    },
    {
      "id": "ed_menhir",
      "name": "Menhir",
      "era": 1,
      "classes": [
        "religione"
      ],
      "terrain": "bosco",
      "width": 1,
      "cost": {
        "pietra": 2,
        "oro": 0
      },
      "flexible": false,
      "resistance": 4,
      "rendita": 1,
      "lampo": 0,
      "scavo": 3,
      "level_required": 0,
      "production": {
        "pietra": 0,
        "oro": 0,
        "cultura": 0
      },
      "exhaustible": 0,
      "effect_text": "Piccolo ma quasi indistruttibile."
    },
    {
      "id": "ed_palafitte",
      "name": "Palafitte",
      "era": 1,
      "classes": [
        "civico"
      ],
      "terrain": "fiume",
      "width": 1,
      "cost": {
        "pietra": 1,
        "oro": 0
      },
      "flexible": false,
      "resistance": 2,
      "rendita": 0,
      "lampo": 1,
      "scavo": 2,
      "level_required": 0,
      "production": {
        "pietra": 1,
        "oro": 0,
        "cultura": 0
      },
      "exhaustible": 0
    },
    {
      "id": "ed_cava",
      "name": "Cava",
      "era": 1,
      "classes": [
        "commercio"
      ],
      "terrain": "pianura",
      "width": 1,
      "cost": {
        "pietra": 1,
        "oro": 0
      },
      "flexible": true,
      "resistance": 1,
      "rendita": 0,
      "lampo": 0,
      "scavo": 2,
      "level_required": 0,
      "production": {
        "pietra": 2,
        "oro": 0,
        "cultura": 0
      },
      "exhaustible": 4
    },
    {
      "id": "ed_focolare_comune",
      "name": "Focolare comune",
      "era": 1,
      "classes": [
        "civico"
      ],
      "terrain": "pianura",
      "width": 1,
      "cost": {
        "pietra": 1,
        "oro": 0
      },
      "flexible": false,
      "resistance": 1,
      "rendita": 0,
      "lampo": 1,
      "scavo": 2,
      "level_required": 0,
      "production": {
        "pietra": 0,
        "oro": 0,
        "cultura": 0
      },
      "exhaustible": 0,
      "effect_text": "Quartiere: +1 pietra quando abiti qui.",
      "effects": [
        {
          "hook": "on_activate",
          "op": "resource",
          "pietra": 1,
          "target": {
            "is_self": true
          }
        }
      ]
    },
    {
      "id": "ed_trappole_da_pesca",
      "name": "Trappole da pesca",
      "era": 1,
      "classes": [
        "ingegneria"
      ],
      "terrain": "fiume",
      "width": 1,
      "cost": {
        "pietra": 1,
        "oro": 0
      },
      "flexible": true,
      "resistance": 1,
      "rendita": 0,
      "lampo": 0,
      "scavo": 0,
      "level_required": 0,
      "production": {
        "pietra": 1,
        "oro": 0,
        "cultura": 0
      },
      "exhaustible": 0
    },
    {
      "id": "ed_circolo_di_pietre",
      "name": "Circolo di pietre",
      "era": 1,
      "classes": [
        "religione"
      ],
      "terrain": null,
      "width": 2,
      "cost": {
        "pietra": 3,
        "oro": 0
      },
      "flexible": false,
      "resistance": 4,
      "rendita": 1,
      "lampo": 0,
      "scavo": 5,
      "level_required": 0,
      "production": {
        "pietra": 0,
        "oro": 0,
        "cultura": 0
      },
      "exhaustible": 0,
      "effect_text": "Lo Stonehenge della strada."
    },
    {
      "id": "ed_villaggio_palizzato",
      "name": "Villaggio palizzato",
      "era": 1,
      "classes": [
        "militare"
      ],
      "terrain": "pianura",
      "width": 2,
      "cost": {
        "pietra": 2,
        "oro": 0
      },
      "flexible": false,
      "resistance": 2,
      "rendita": 0,
      "lampo": 1,
      "scavo": 2,
      "level_required": 0,
      "production": {
        "pietra": 0,
        "oro": 0,
        "cultura": 0
      },
      "exhaustible": 0,
      "effect_text": "Quartiere: +1 res ai tuoi edifici adiacenti.",
      "effects": [
        {
          "hook": "on_event",
          "op": "resistance",
          "value": 1,
          "target": {
            "owner": "self",
            "adjacent_to_self": true
          }
        }
      ]
    },
    {
      "id": "ed_tumulo_funerario",
      "name": "Tumulo funerario",
      "era": 1,
      "classes": [
        "religione",
        "cultura"
      ],
      "terrain": "collina",
      "width": 2,
      "cost": {
        "pietra": 2,
        "oro": 0
      },
      "flexible": false,
      "resistance": 3,
      "rendita": 0,
      "lampo": 1,
      "scavo": 5,
      "level_required": 0,
      "production": {
        "pietra": 0,
        "oro": 0,
        "cultura": 0
      },
      "exhaustible": 0
    },
    {
      "id": "ed_teatro",
      "name": "Teatro",
      "era": 2,
      "classes": [
        "cultura"
      ],
      "terrain": null,
      "width": 1,
      "cost": {
        "pietra": 2,
        "oro": 0
      },
      "flexible": false,
      "resistance": 3,
      "rendita": 0,
      "lampo": 2,
      "scavo": 5,
      "level_required": 0,
      "production": {
        "pietra": 0,
        "oro": 0,
        "cultura": 0
      },
      "exhaustible": 0,
      "effect_text": ""
    },
    {
      "id": "ed_acquedotto",
      "name": "Acquedotto",
      "era": 2,
      "classes": [
        "ingegneria"
      ],
      "terrain": "fiume",
      "width": 3,
      "cost": {
        "pietra": 3,
        "oro": 0
      },
      "flexible": true,
      "resistance": 4,
      "rendita": 1,
      "lampo": 0,
      "scavo": 3,
      "level_required": 0,
      "production": {
        "pietra": 0,
        "oro": 0,
        "cultura": 0
      },
      "exhaustible": 0,